"A Polish-American engineer and inventor. In the 1960s Drexel graduate Golaski perfected the Dense Knit Dacron Vascular Prosthesis, the first practical artificial blood vessel replacement, a life-saving medical advance. He began his career designing innovative machinery for the knitting industry, for which he received numerous patents. He encouraged scholarly and cultural exchange between Poland and the US. His workshop was here for many years.""Meeting place built in 1846-47 adjacent to Byberry Friends Meeting by renowned African American abolitionist Robert Purvis and others to facilitate public discussion of slavery and other social issues. Many famous abolitionists such as James and Lucretia Mott and William Lloyd Garrison spoke here. Purvis’s farm estate across Byberry Road was a regular station on the Underground Railroad. Purvis estimated he helped over 9,000 to escape.""In 1729, Rev. Joseph Greaton, SJ, established the earliest foundation of Catholicism in Pa. He was the church’s first pastor and the only Catholic priest in Philadelphia when the church was built in 1733. Jesuits from this parish founded the early frontier missions of Conewago in Adams County and Goshenhoppen in Berks County, as well as the first Catholic churches in New Jersey and Delaware.""Following the creation of the US Navy in 1794 under President Washington, Barry was appointed first commissioned officer and Secretary. He oversaw construction of the nation’s first fleet. He won numerous naval victories during the American Revolution, many on the Delaware River. Irish-born Barry came to Philadelphia as a youth and assumed command of his first ship at age 21. He remained in naval service until his death at Strawberry Mansion.""An Irish Catholic who emigrated to Philadelphia in 1784, Carey was a prominent printer and publisher and prolific writer. He was an influential political economist and nationalist, promoting the purchase of American goods over imports, a strong central bank, and protective tariffs. He was a civic leader and a founder of the Hibernian Society (1793), which provided support and relief for Irish immigrants. His print shop was here, 1792-1813.""In 1911 at the Chicago Golf Club, 19-year-old McDermott became the first American to win the US Open. He successfully defended his title the following year. One of the world’s top golfers between 1910 and 1914, he helped to popularize the game in this country. His career was cut short due to illness and he retired in 1914. This is his childhood neighborhood, where he caddied and learned to play at the Aronimink Golf Club, once located here.""Sixty-four former Edison students died in service to their country during the Vietnam War between 1965 and 1971 – more than any school in the nation. These young men represent the burden and disparity of the war on poor rural and urban communities throughout America. Whether they enlisted voluntarily or were assigned draft numbers that they were unable to avoid by deferment, these men made the ultimate sacrifice.""The Pennsylvania Historical and Museum Commission declares Fairmount Park a Commonwealth Treasure for all to protect, preserve and enjoy the historical, architectural, environmental, botanical, cultural and recreational diversity of one of the largest city parks in the world.""One of America’s most popular artists, Parrish was a pioneer in commercial and graphic art. A master illustrator, he was innovative in incorporating art in advertising. He is known for his signature vibrant blues, his choice of fantastical subjects, and capturing the spontaneity of action. He studied at the Pa. Academy of the Fine Arts and under Howard Pyle at Drexel. His Dream Garden mosaic here was created with Tiffany Studios in 1915.""Established in 1830, the church served as the Roman Catholic cathedral for Pennsylvania, Delaware, and part of New Jersey from 1838 to 1864. A strong patron of the arts, the church was decorated in 1832 with frescoes by artist Nicola Monachesi. In 1834 it was the venue for the American premier of Mozart’s Requiem Mass in D Minor in its entirety. The original building burned in 1899; it was rebuilt and consecrated in 1902.""Established in 1968 by Joseph Tarsia, Sigma was known worldwide for its distinctive sound and recording innovations. Hits by The O’Jays, Stylistics, and others produced at 212 N 12th St. by Gamble, Huff, and Bell drew top recording artists such as David Bowie and Stevie Wonder.""Arriving in Philadelphia in 1705, Palmer established himself as a merchant. He served on provincial council and held several judicial posts. He became acting governor in 1748-1749 and used his diplomatic acumen to negotiate with the French, Spanish, and Native Americans. He worked with Benjamin Franklin to acquire the support and revenue to fortify and defend Pa. against raiding privateers. He founded the community of Kensington in the 1730s.""Founded by Philadelphia Quakers in 1689 and first chartered by Penn in 1701, it was Pennsylvania’s first public school and is the oldest continuously operating Friends school in the world. Pioneering educational initiatives were based on public charity and inclusion: free tuition to the poor, education for both genders, and acceptance of all races. Quaker roots and Penn’s vision have been maintained. It moved to the present site in 1925.""World’s oldest medical library association founded here in 1898 to facilitate access to reliable medical literature for the improvement of health care. Among the US and Canadian founders were George M. Gould, MD; Sir William Osler, MD; and Margaret R. Charlton, librarian.""Cofounder of the first medical society and first homeopathic medical school in the US, Hering discovered major medicines and authored definitive texts on homeopathy. He advanced the art of healing through research and education. His home office was here.""One of America’s first woman editors, Hale greatly increased subscriptions to Godey’s Lady’s Book in her four decades as editor. She successfully promoted a national Thanksgiving Day to President Lincoln. The author and women’s rights advocate lived here.""Greenfield created an East Coast business empire here in retail, real estate, hotels, and banks. He supported equality for African Americans and received a papal award for promoting Catholic/Jewish harmony. He championed political reform locally and nationally.""Innovator of basketball statistics and player evaluation. NBA statistician from 1946 to 2014 with the Philadelphia Warriors and 76ers. Known as “Super Stat,” he revolutionized analysis by creating categories such as rebounds, assists, and turnovers. A Temple graduate, he received a Lifetime Achievement Award from the Naismith Memorial Basketball Hall of Fame in 2002. His annual NBA statistical guide was in demand worldwide.""An exceptional collection of early American structures, built 1720s-1830s, the alley contained the homes and shops of diverse artisans. Later, working-class immigrants lived here and labored in nearby industries. Residents began preservation efforts in 1934.""Leading abolitionist in the 18th century, his writings influenced the antislavery movement worldwide and federal abolition legislation. A teacher and Quaker, he educated blacks in his home, 1750-70, and opened a secondary school for girls in 1754. He lived here.""First shopping center in the US built, owned, and operated by African Americans, it was established in 1968 by Rev. Leon H. Sullivan, Zion Baptist Church members, and the local black community. Its success attracted national attention; it led President Nixon to fund the Progress Development Services Corp. to aid blacks nationwide with commercial development projects. It encouraged black capitalism, inspiring similar economic ventures.""Known as the mother of the LGBT civil rights movement, Gittings, who lived here, edited The Ladder, the first wide-spread lesbian journal. She led initiatives to promote LGBT literature in libraries and to remove homosexuality’s classification as a mental illness.""African people, first enslaved by the Dutch and Swedes, survived the brutal voyage from Africa to the Caribbean islands and the Americas, debarking on the Delaware River waterfront as early as 1639. William Penn, other Quakers, and Philadelphia merchants purchased and enslaved Africans. As the institution of slavery increased, these courageous people persevered and performed integral roles in building Pennsylvania and the nation."Pennsylvania’s first Nation of Islam place of worship. Former home of the African American Muslim community of Philadelphia during the 1950s and 1960s under the leadership of Elijah Muhammad. Malcolm X and Imam Wallace D. Muhammad were administrators and teachers here."Born in Philadelphia, Kane was a prominent explorer of the Arctic in the 1850s. His writings after his expeditions influenced scientific and popular opinion on the polar regions. He was first to chart a course that became the route that Robert Peary used to claim the North Pole in 1909. When he died, he was so revered that his body was sent on a two-week cortege across the country before being interred in its final resting place here.""Nobel laureate who identified the hepatitis B virus and developed its diagnostic test and vaccine, which he shared to promote its use. Affiliated with Fox Chase Cancer Center, NASA Astrobiology Inst., and pres. of American Philosophical Society. Blumberg lived here.""Founded in 1883, this benevolent society of colored hotel workers was one of the largest and most influential early trade organizations in the hotel industry. It promoted labor equality, worker respect, and economic empowerment. Headquartered here since 1906."