"Founded in 1899 by Rev. Matthew Anderson, pastor of Berean Presbyterian Church and founder of Berean Savings Association, this school taught Blacks skilled trades not available elsewhere. Later the curriculum was expanded to meet changing student needs.""An abolitionist, Purvis fought for the rights of Blacks through his lecturing, writing, and activity in antislavery societies. As an agent for the Underground Railroad, he built a secret area here at his house to hide slaves.""Oaks Cloister, built in 1900, was the home and studio of Philadelphia born Huston, architect of the PA Capitol. His Tudor home incorporates architectural elements and artwork by many capitol artists. He began his career with Furness and Evans, starting his firm in 1895.""Country house designed by Frank Furness (1839-1912), one of the 19th century's most innovative architects. Built in 1881 for banker William Rhawn, its design captured the spirit of the Victorian age and set new standards for domestic architecture.""George Washington died on December 14, 1799. Congress set Dec. 26 as a day of formal mourning in Philadelphia, the nation's capital from 1790 to 1800. The national funeral service was in Zion Lutheran Church--located at this site, 1766-1870--and among those attending was President John Adams. In his funeral oration, Congressman Henry Lee spoke the famous tribute: ""First in war, first in peace and first in the hearts of his countrymen.""""The elder brother of Napoleon and deposed king of Naples & Spain lived here, 1815,-1816. The house was built about 1813. During Joseph's occupancy here, this was a gathering place for Bonapartist refugees & other French nationals.""Founded in 1836 and designed by Scottish architect John Notman, this was the nation's second major rural cemetery. With its rolling landscape, horticultural plantings, and eclectic architecture, it offered a romantic alternative to the crowded urban environment. Overlooking the Schuylkill River, 3.5 miles north of center-city, it had grown by 1861 to 78 acres. This cemetery was designated a National Historic Landmark in 1998.""ENIAC, the Electronic Numerical Integrator and Computer, was invented by J. Presper Eckert and John W. Mauchly. It was built here at the University of Pennsylvania in 1946. The invention of this first all-purpose digital computer signaled the birth of the Information Age.""In the Musical Fund Hall here in June 1856, John C. Fremont was nominated for President of the U.S. He lost the election to James Buchanan. Formed in 1854 the Republican Party opposed the extension of slavery; Lincoln was its first nominee elected President (1860).""The holder of the first U.S. patent, signed by George Washington, lived here. On July 31, 1790, Hopkins received a patent for an improvement in making potash, a major industrial chemical. In succeeding centuries, the U.S. Government issued millions of patents.""One of America's earliest railroads, authorized by the state legislature in 1828 and completed in 1834. Stretching 82 miles west to the Susquehanna, it was powered first by horses, later by steam. Part of a state-owned transportation system, including the Pennsylvania canal, built in response to intense competition from adjacent states. Acquired by the Pennsylvania Railroad Co. in 1857. Stone blocks placed for the original track have remained visible here.""Founded by Germantown Quakers in 1885. This Club joined the national Boys Club Federation in 1906 - the first member to serve an African American population. Under president John T. Emlen & executive director William T. Coleman, it earned a reputation for outstanding service to youth. Club alumni include Bill Cosby, Herb Adderley. Renamed the Wissahickon Boys & Girls Club in 1981, it moved here from Coulter St. & Pulaski Ave. in 1985.""A leader in the women's rights movement and a homeopathic physician and surgeon. She was founder of Providence General Hospital (chartered 1913), the principal officers of which were women. From 1914 to 1917 it served the community from nearby Abraham Rittenhouse Home. Political pressure then forced the hospital to move from this site, and it closed shortly after Dr. Ridgway's death.""Author of ""The Virginian"" (1902), which became the prototype for the Western novel. This work defined the cowboy as folk hero & coined the phrase, ""When you call me that, smile!"" Born here, Wister was a lifelong resident of the Philadelphia area.""Professional society created, Oct. 6-8, 1852, to assure quality & safe distribution of drugs. Pharmacists from eight states met in a building nearby for the founding meeting; among them was Philadelphian William Proctor, Jr., ""Father of American Pharmacy.""""In 1840, John Wagner brought lager yeast from his native Bavaria and brewed the nation's first lager beer. Later, other German immigrants began brewing lagers, which soon became popular & promoted growth of America's brewing industry.""Opened on June 2, 1927, the Central Library was designed in the Beaux Arts style by Horace Trumbauer & Julian Francis Abele. It was built to serve as the main building of the Free Library of Philadelphia, chartered in 1891.""Physician, humanitarian, educator, patriot leader. He signed the Declaration of Independence, opposed slavery, and supported public health & social reforms. Known as ""Father of American Psychiatry."" His house of birth stood here until 1969.""1st President of Czechoslovakia (1918-1935). On October 26, 1918, he led a gathering of 25 delegates from 12 Central & East European nations at Independence Hall, and delivered the Declaration of Common Aims, a Declaration of Independence for these nations.""The nation's first children's hospital, 1855. A pioneer in pediatric care, preventive medicine, and research, the hospital developed lifesaving vaccines, invented newborn surgical techniques, and advanced care for children with cancer.""Designer of the reverse side of the Lincoln Penny and, with Gilroy Roberts, the Kennedy half-dollar. Born & educated in classical art in Philadelphia, Gasparro was first employed as a junior engraver by the U.S. Mint in 1942. By 1965 he was appointed by President Lyndon Johnson as the 10th Chief Engraver. Designed numerous coins and medals, including, the Eisenhower & Susan B. Anthony dollar.""Internationally renowned vertebrate paleontologist and zoologist, Cope lived and worked here in his later years. He wrote many scientific papers describing hundreds of fossils & living animals and is famous for his long-standing feud with O.C. Marsh of Yale.""Born & educated in this city, this leader of the Zionist movement, author, and conservative rabbi presided over many organizations, including the Jewish Nation Fund (1933-43), Zionist Organization of America (1943-61), & American Jewish Congress (1951-58), and was a founder of Brandeis College. He moved to Israel in 1961.""With William Clark he led the transcontinental Lewis & Clark Expedition, 1803-1806. Lewis prepared for the journey & later deposited its significant specimens, journals, and other artifacts here in Philadelphia.""Oldest church in Philadelphia. Founded, 1677, by Swedish settlers. This edifice of Swedish architectural design was erected, 1698-1703. The earlier place of worship was a blockhouse.""Known also as the Association Battery, this was Pennsylvania's largest early fortification. Originally built in 1748, shortly after formation of a volunteer military force called the Association, it mounted 27 guns; within a few years it held some 50 guns. Later the first Philadelphia Navy Yard was here, 1800-1875. A short distance to the north, the smaller Society Hill Battery was built in April 1748; it mounted 13 guns.""Founded in 1844, this was the first Black lodge in Pennsylvania and the third in the United States. A benevolent fraternity, it provided funds for sick and disabled members. In 1908 the national headquarters were erected here.""Greenfield, who lived here, was one of the 19th century's leading singers, known as the ""Black Swan"" because of her great vocal range. Her performances were hailed in the U.S. and in England where she sang before the Queen.""An author, lecturer, and social activist, Harper lived here and devoted her life to championing the rights of slaves and free Blacks. She advocated education as a way of advancement for Black Americans.""Known as ""Lady Day,"" she was called the greatest jazz vocalist of her time. Starting in 1933, she recorded with Benny Goodman, Teddy Wilson, and others. Notable songs include ""Lover Man,"" ""Strange Fruit."" In this city, she often lived here.""Appointed by William Penn in 1682 as Surveyor General of Pennsylvania. A member of its first Assembly, 1682, and its Provincial Council, 1683-86. Under Penn's direction, Holme laid out the original portion of Philadelphia. He drafted the first map of this city, 1683, and a map of the settled parts of Pennsylvania, 1687. Here on his estate he was buried - as were members of the Crispin family, relatives of Penn.""Founded 1846, this was Pennsylvania's first such institution. Irish Catholics, other immigrants, & native-born were its constituency. Services to the needy included training programs for persons seeking work, designed to encourage their ultimate independence.""Begun as a farm school. In 1852 it became one of the first schools to train Blacks for skilled trades and teaching. It gained recognition here under Fanny J. Coppin, principal, 1869-1902. Relocated, it later became Cheyney University.""America's first circus building was opened here at 12th and Market Streets, April 3, 1793. On that day the English equestrian John Bill Ricketts gave America's first complete circus performance. President Washington attended his show later that season.""William Rittenhouse, first Mennonite minister in America, erected here in 1690 the colonies' first paper mill. Successive generations of Rittenhouses built additional mills, establishing this region as the center of American papermaking. By the 1850s this village had over 40 buildings, and seven early buildings survive from this once prosperous industrial community. Scientist David Rittenhouse was born here in 1732.""First U.S. foundation, Augustinian Order, 1796. In 1844 the original church here was burned during Nativist riots. This and other violence led to a state law requiring police forces, 1845, and to consolidation of the city and county, 1854.""Founded in 1852 as the first Italian national parish in the U.S. by St. John N. Neumann, Bishop of Philadelphia. New churches were dedicated here, 1854 & 1891. The Delaware Valley's largest Italian community became centered in this neighborhood.""Dedicated in 1892 and named for a 16th century saint who fought the slave trade, this was the first Roman Catholic church for Blacks in the city. It has served as a Black community cultural center since the 1920s.""Organized in 1792 as an outgrowth of the Free African Society, formed 1787. The original church edifice stood here. Under the ministry of the Rev. Absalom Jones (1746-1818), a former slave, this became the nation's first Black Episcopal church.""Financier of the Revolution. Came to America ca. 1772. Imprisoned by British, 1776 and 1778. Lived in Philadelphia, 1778-85; active in its Jewish community. A broker, he lent money heavily to support the war. Never repaid, he himself died in debt.""The first U.S. corps was opened here on Oxford St. by 17-year-old Eliza Shirley in 1879. She came from England, assigned by the founder, William Booth. This organization would become the largest private charity in the U.S., giving spiritual and social help to the needy.""First in the nation. Built 1808 by Thomas Sparks & John Bishop to make hunting shot, it symbolized a new U.S. industrial independence. Bishop, a Quaker, sold his share when ammunition was made here for the War of 1812. The Sparks family stayed in control until 1903.""Here stood the home of colonial Philadelphia's leading architect and builder. Born Jan. 14, 1722 at Dalkeith, Scotland, he died Feb. 11, 1777. Among his buildings are the Christ Church steeple, St. Peter's Church, the Walnut Street Prison, and Carpenters' Hall.""An abolitionist, Smith bought his freedom and was one of America's wealthiest Blacks with his coal, lumber, and real estate ventures. He was the major benefactor of the Stephen Smith Home for the Aged, located here.""Early Major League baseball park opened here, 1909. Renamed, 1953. Home to Athletics, 1909-1954; Phillies, 1938-1970. Site of three Negro League World Series; five A's World Series victories. Among first to host night games. Razed, 1976.""Owned by Black entrepreneur John T. Gibson, this theater featured noted Black American entertainers of the 1920s including Duke Ellington and Ethel Waters. The theater attracted multi-racial audiences until it closed in 1931.""While living here, he was an Underground Railroad agent who helped slaves escape and kept records so relatives could find them later. A wealthy coal merchant, Still also helped found the first Black YMCA.""While living here, Tanner studied at the Pennsylvania Academy of the Fine Arts. His earlier works portrayed the ordinary lives of African-Americans. After moving to Paris, Tanner painted religious subjects and won international acclaim.""Founded 1902 as East Calvary Methodist Church. Renamed for its founder, Rev. Charles A. Tindley. Born a slave in Maryland, he did much to assist later migrants from the South. After his death, Tindley Temple continued to sponsor needed community programs.""Chartered 1935 after African-American musicians were denied admission to Local 77. John Coltrane, Dizzy Gillespie were members. At its 1971 demise, it was last predominantly Black AFM local in U.S. Union office was here.""Founded in 1917 by Marcus Garvey, this movement inspired African-American pride. It encouraged self-reliance, spread news of interest to Blacks, and urged them to establish nationhood in Africa.""First vessel completed for new U.S. Navy. Frigate was launched near here May 10, 1797. Flagship of Capt. John Barry; builder was Joshua Humphreys. In 1812, under Capt. Stephen Decatur, Jr., occurred its celebrated capture of H.M.S. Macedonian. Vessel scrapped at Norfolk, 1866.""""Father of Jazz Violin."" Classically trained as a child, Venuti went to grade school here. He introduced new string techniques; worked with his close friend, guitarist Eddie Lang, 1921-33. Led own band, 1935-43; was on screen & radio. Major comeback in 1968.""One of the nation's first urban penal institutions, it confined felons, prisoners of war, Tories, and debtors from 1775 to 1838. Extending from Walnut St. to Locust St., it was the site of numerous riots. The prison was replaced by Eastern State Penitentiary."Founded 1809. The oldest theater in America and the oldest playhouse in continuous use in the English-speaking world. A National Historic Landmark. Many of the greatest actors of America and Europe have appeared on stage here."Philadelphia merchant, famed for the department stores bearing his name. In 1861 he opened his first store. He built his ""new kind of store"" here in 1876 and implemented new concepts including the one-price system & money-back guarantee. Active in public life, he built schools, churches, and missions in this and other nations. As U.S. Postmaster General, 1889-93, he fostered rural free delivery and introduced the commemorative stamp.""Since the 1870s, the station was an entry point and processing center for immigrants, primarily from Eastern and Southern Europe. From here, newcomers moved into the city or other parts of the state. It was demolished in 1915.""A Black portraitist who lived here, Waring studied art in this city and in France. She headed the Art Department, Cheyney State College, and her works are part of the National Portrait Gallery and other major collections.""A founder, American Moral Reform Society, he edited its journal, 1838-39. Active in the Underground Railroad, he aided hundreds of slaves passing through Columbia, Pa., 1847-60. Conducted lumber business in Columbia and this city. Later lived here.""A Black educator who lived here, White was the principal of the Robert Vaux School for forty years. He was a founder of the city's first Black baseball club, the Pythians, and the first president of the Frederick Douglass Memorial Hospital.""Opened May 30, 1884 by the industrialist Henry H. Houston as a 250-room summer resort hotel. The architects were G.W. and W.D. Hewitt. Since 1898 the Inn has served Chestnut Hill Academy (founded 1850) which acquired ownership, 1940.""A child of Italian immigrants, Brancato entered Democratic city politics in 1928. One of few women in the state assembly (1932-41), she sponsored pioneering social reform legislation. Her business offices were located here.""Here, William Hamilton (1745-1813) created one of the finest landscape gardens of its day and introduced many exotic plants. His mansion and stable, built 1787-92, are early examples of the neoclassical Adamesque-Federal style. In 1840 the estate became one of the first large rural cemeteries in America. The writer S. Weir Mitchell, artist Thomas Eakins, nurse-reformer Alice Fisher, and architect Wilson Eyre are buried here.""On the second floor of a three-story brick house that stood here, Thomas Jefferson prepared the draft of the Declaration of Independence in June, 1776.""Founded by Anna Jarvis of Philadelphia. First officially observed in 1908, it honored motherhood & family life at a time of rising feminist activism. An early supporter was John Wanamaker, whose store stood opposite. Mother's Day was given federal recognition, 1914.""Philadelphia-born, he was one of this city's noted composers. He wrote nine symphonies & many other instrumental & choral works. A 1939 Curtis Institute graduate, he taught at the Philadelphia Conservatory, 1939-62, & Juilliard School, 1947-87.""Artist famed for her murals in Pennsylvania's State Capitol, reflecting Penn's ideals of justice & peace. Also noted for her work in stained glass; book & magazine illustrations. One of three women artists who moved in 1906 to ""Cogslea,"" she lived & worked here until 1961.""One of the leading Black female sculptors in America. She lived here, studied at the Pennsylvania Academy of the Fine Arts, later with Auguste Rodin in Paris. Her sculpture depicted human suffering.""A Rutgers athlete and Columbia law graduate, Robeson won renown as a singer and actor. He was a noted interpreter of Negro spirituals. His career suffered because of his political activism, and he lived his last years here in retirement.""The eminent Jewish leader is buried here. Minister, Congregation Mikveh Israel, 1829-1850. Founder of the influential journal, The Occident, 1840; its publisher until 1868. A teacher and scholar, he translated the Hebrew Bible into English, 1853.""Here in the 1974 the first eleven women Episcopal priests were ordained. This noted Gothic Revival church, built 1887-97, served a growing African American community after 1930. Host to major Black Power events of the 1960s and '70s. National Historic Landmark.""Founded in Philadelphia in 1917, the AFSC has given practical expression to the faith of the Religious Society of Friends (Quakers). Its worldwide humanitarian work has reflected a commitment to nonviolence & justice. Co-recipient, Nobel Peace Prize, 1947.""Soldier, civil engineer. Major General, U.S. Army. Commander, victorious Army of the Potomac at Battle of Gettysburg, 1863. Philadelphia was his family's home; he died at No. 1836 here, in a house given to him for his service to the nation."Annual public demonstrations for gay and lesbian equality were held at Independence Hall. These peaceful protests and New York’s Stonewall riots in 1969 & Pride Parade in 1970 transformed a small national campaign into a civil rights movement."A multi-purpose stadium opened here in 1971 and served as home to Philadelphia Phillies and Philadelphia Eagles, 1971-2003. The stadium was the site of three World Series in 1980, 1983, and 1993; two Major League Baseball All-Star games in 1976 and 1996; two National Football Conference Championship games in 1981 and 2003; and 17 Army-Navy football games. ""The Vet"" had a seating capacity of over 65,000; razed in 2004.""Acclaimed operatic family. Father, tenor Ferruccio (1868-1948), sung on first disc, 1896. Daughter Dusolina (1900-86) was a Metro- politan Opera soprano. Son Vittorio (1903-66) was a composer & taught at Curtis Institute and Juilliard. Resided here.""First Civil War U.S. Army Hospital, founded May, 1861. Here Drs. Mitchell, Keen, Morehouse, and others used electric current, drugs, and other experiments in pioneering treatment of nerve and related disorders. Closed 1865.""Founded in 1898 as the Graphic Sketch Club; oldest free community art school in the United States. Nearly 5,000 students study art here annually. Alumni include Frank Gasparro, former chief engraver for U.S. Mint, and Louis Kahn, renowned architect."William Penn's first Surveyor General of Pennsylvania made his city home near this spot. He mapped the city in 1683 and the province of Pennsylvania in 1687."On this site was the home 1766-1771 of John Penn 1729-1795, last Colonial Governor of Pennsylvania. Son of Richard Penn and grandson of William Penn, the Founder. Also the home 1771-1810 of Benjamin Chew, 1722-1810, last Colonial Chief Justice of Pennsylvania...""Francis Daniel Pastorius founder of Germantown, 1651-1719, built here in 1683 on a lot 102 feet front a dugout *his first American home* in which, October 25, 1683, the thirteenth original settlers of Germantown drew lots for their new homes. He placed ...""Hannah Penn, 1670-1726, second wife of William Penn presided ably here in the slate roof house 1699-1701. Capable administrator of Pennsylvania affairs 1712-1726. Devoted mother whose sons John, Thomas and Richard Penn succeeded their father as proprietor...""William Penn with his family lived on this site in the slate roof house on his second visit to Pennsylvania 1699-1701 as tenant of Samuel Carpenter. Here in 1699 was born John Penn, called ""The American"" because he was the only child born to the Founder ...""The last library funded by noted philanthropist Andrew Carnegie opened here October 30, 1930, as the Wyoming Avenue Branch of the Free Library of Philadelphia. Pittsburgh industrialist Carnegie endowed more than 2,500 libraries worldwide, including many in Philadelphia.""Here on August 1, 1842 an angry mob of whites attacked a parade celebrating Jamaican Emancipation Day. A riot ensued. African Americans were beaten and their homes looted. The rioting lasted for 3 days. A local church & abolition meeting place were destroyed by fire.""In 1813 Henry Whitaker built a waterwheel textile mill and town here. William Whitaker & Sons, Inc. continued operations for 157 years in original buildings. Canvas & wool blankets were produced for the Civil War. First mill in the U.S. to produce bed ticking. Chenille manufacturing processes were patented. Owners ceased production in 1970. The mill was destroyed by arson & demolished in 1975. Several original buildings remain nearby.""World Light Heavyweight Champion from 1927 to 1929. He boxed during the ""Golden Age of Boxing"" in many weight classes, besting 10 champs in his 18-year career. The “Philly Phantom” had a scientific style, built on precision and maneuverability rather than brute force. Considered a gentleman both in and out of the ring. In 1991 he was elected to the International Boxing Hall of Fame. Loughran was devoted to his neighborhood and church here.""In a covert CIA plan named the Jennifer Project, this ship was built at Sun Shipbuilding and Dry Dock Company, Chester, in the early 1970s and played a key role in US Cold War espionage. Its mission was to obtain intelligence by recovering a sunken Soviet submarine, three miles deep in the Pacific Ocean. Portions of the sub were raised by the ship's huge claw in the summer of 1974; six Soviet submariners were recovered and given a burial at sea.""Some of the nation's earliest motion pictures were made here between 1897 and 1899 in the backyard of film pioneer Lubin's home. Vaudeville and burlesque routines, boxing matches, circus performers, animal acts, and a Passion Play were among the subjects he filmed.""Polish immigrant and civil engineer, Modjeski was one of the most influential figures in American bridge building. He completed the Quebec Bridge on the St. Lawrence River and over 40 others, earning numerous awards. He was chief engineer and designer for the Benjamin Franklin Bridge here, opened in 1926."One of several curb markets established in the early 20th century to counter high prices and food shortages during WWI. The 9th St. Market has survived despite anti-immigrant sentiments and criticisms regarding sanitary conditions and traffic congestion. Neighborhood businesses offered fresh produce and a variety of ethnic specialty foods. It has evolved from a local community market to become a popular Philadelphia icon."Opened here, 1881, by the Pennsylvania Railroad; enlarged 1893. This was once the world's largest railroad passenger terminal. Its great arched train shed burned, 1923. The station and its long elevated stone track bed (the ""Chinese Wall"") remained until 1952-53."The nation's first independent biomedical research institution was founded in 1892 by Isaac Jones Wistar. It houses the anatomical collection of the Wistar and Horner Museum. Many critical vaccines and the albino Wistar rats used in medical research were developed here.