"""Father of Jazz Guitar."" He was born Salvatore Massaro in 1902 and lived in this area as a boy. An accomplished soloist, Lang worked with Joe Venuti, Paul Whiteman, the Dorseys, and others. He was Bing Crosby's accompanist when death cut short Lang's career in 1933.""The beloved tenor was born here as Alfredo Cocozza. Here as a boy he learned the arias of many operas. Became a radio, concert, record artist. After signing with M-G-M in 1947, he made seven films; had the title role in ""The Great Caruso,"" 1951.""Born here, Locke was an African-American critic and chronicler of the Harlem Renaissance. A Harvard graduate, Rhodes Scholar, and Howard University educator, he was a writer and promoter of Black art and culture.""Scene of political and commercial activity in the colonial period, the London Coffee House opened here in 1754. It served as a place to inspect Black slaves recently arrived from Africa and to bid for their purchase at public auction.""A motion picture pioneer, famed as the first movie mogul. In optical shop here in 1897, began his empire of six studios in five states. His technical genius and marketing skill did much to popularize the medium. Bankrupt by 1916; died in obscurity.""""Grand Old Man of Baseball."" He started as a catcher in New England, 1883. As manager of the Philadelphia Athletics, 1901-1950 -- a record fifty years -- he led the team to nine American League pennants, 1902-31, & five World Series championships, 1910-30. In baseball's first All-Star Game, he managed the victorious American League team, 1933. Elected to the Baseball Hall of Fame, 1937. He lived on Cliveden Street here.""Father and son lived at 912 Walnut Street after 1832. Home of George McClellan, M.D., founder, Jefferson Medical College, until he died in 1847. Home until 1842, future Gen. George B. McClellan, commander, Army of the Potomac, 1861-62; U.S. Presidential candidate in 1864.""Founded in 1907 by African-Americans, this hospital provided training and employment to Black medical professionals. In 1919 it built a larger facility here, and in 1948 it merged to become Mercy-Douglass Hospital.""Founded 1740. Notables buried here include Nathan Levy, whose ship brought the Liberty Bell to America; Haym Salomon, Revolutionary patriot; the Gratz family; and Aaron Levy, founder of Aaronsburg.""Teacher and journalist lived here. Wrote for many publications on race and feminism. Her books included ""The Work of the Afro-American Woman."" Fundraiser for Frederick Douglass Hospital; her husband was its founder.""Founded on ground purchased by Richard Allen in 1787, this congregation is the mother church of the African Methodist Episcopal denomination. The present structure, erected in 1889, replaces three earlier churches on this site.""A veteran of the Civil War, he was a leading military historian. Editor & compiler of the two-volume Pennsylvania at Gettysburg. Active in preservation efforts at Gettysburg & Valley Forge. In 1888, a founder of The Civil War Library & Museum.""Founded 1882 by Eliza S. Turner. One of the oldest and largest organizations created to advance the interests of women in the labor force. Originally located on Girard St., the Guild moved to Arch St. in 1893 and to this location in 1906.""Here lie the remains of the first male American saint, canonized in 1977. Born 1811 in Bohemia, he came to the U.S. in 1836. A devoted Redemptorist priest, he became fourth Bishop of Philadelphia, 1852, and set up nation's first Catholic diocesan school system. Died, 1860.""Established here in an abandoned jailhouse in 1964, O.I.C. was founded by Rev. Leon H. Sullivan and achieved worldwide recognition as a self-help vocational training center for Blacks which opened job opportunities formerly closed to them.""American painter, noted for his portraits of George Washington. Here, Peale opened in 1786 his museum of art & natural science. This he moved to Philosophical Hall, 1794; to Independence Hall, 1802 Founder, Pennsylvania Academy of the Fine Arts. Burial a block away."Founded 1895 on this site. Officially named The Penn Relay Carnival and hosted annually by the University of Pennsylvania. It gained recognition as the world's first and largest track and field relay meet and the nation's longest uninterrupted collegiate meet. The Relays have drawn top high school and college athletes from the U.S. and elsewhere and have been the scene of numerous American and world records."Traditional site of a treaty between William Penn and the Indians, this park is maintained by the City of Philadelphia in commemoration of the Proprietor's peaceful relations with the Indians.""Founded here, 1775, as the Society for the Relief of Free Negroes Unlawfully Held in Bondage. In 1787 it became the Pennsylvania Abolition Society which sought social, educational, and employment opportunities for Blacks.""Built on this site in 1838 by the Pennsylvania Anti-Slavery Society as a meeting place for abolitionists, this hall was burned to the ground by anti-Black rioters three days after it was first opened.""This is the first hospital in the U.S. Chartered by Colonial Assembly in 1751 for ""relief of the sick poor."" Benjamin Franklin and Dr. Thomas Bond were its chief founders. First building, erected in 1755, is still used.""Opened with this name by the Pennsylvania Railroad in 1933; later renamed 30th Street Station. One of the largest rail stations in the U.S., with 16 tracks. Its magnificent main concourse has a 95-foot high ceiling. Three earlier stations were in this vicinity.""Founded by William Penn. Laid out in 1682. Chartered a city, 1701. Pennsylvania's capital until 1799; the nation's to 1800. County was one of Pennsylvania's original three, formed 1682 and consolidated with city in 1854. Name means ""City of Brotherly Love.""""Founded in 1821 at historic Carpenters' Hall by prominent apothecaries to improve the standards of pharmacy, the College was incorporated the following year. It is the oldest institution of its kind in the United States.""Present campus of America's first textile college. Founded as the Philadelphia Textile School in 1884, it provided needed technical education to improve the manufacture and quality of domestic fabrics."for the Insurance of Houses from Loss by Fire ------ Oldest fire insurance company in America. Founded in 1752 by Benjamin Franklin and his friends."Organized in 1833 by Quaker abolitionist Lucretia Mott, this society, headquartered here, originally consisted of sixty women who sought to end slavery. After the Civil War, the society supported the cause of the freed slaves.""Founded in 1907 by politician and civic leader, B.G. Collier, this order first met above a South Philadelphia barber shop. In 1913 the lodge moved to this site, erecting a new building here in 1923.""Founded by prominent members of the Black community, this club fostered, encouraged, and gave expression to civic, social, and cultural opportunities for African-Americans denied to them by other organizations in the area.""Founded in 1884 by Christopher Perry, the Tribune, located here, began as a single, hand-printed page dedicated to improving the everyday life of Blacks. It is the oldest continuously published Black newspaper in the nation.""""America''s First Zoo."" Chartered 1859 as the Zoological Society of Philadelphia. A wildlife refuge and a zoological garden, the zoo has long been committed to fulfilling its public mission: conservation, research, education, recreation.""Baptized a Catholic, reared a Moravian, and ordained an Episcopal priest, Phillips transformed the Church of the Crucifixion into a Black cultural center, known for its social outreach. He was a founder, American Negro Historical Society.""Here, in its first General Assembly held May 21-24, 1789, the Presbyterian denomination in America was formally organized on a national basis. This took place in the city's Second Presbyterian Church, which was at this site from 1750 to 1837.""This Masonic lodge was named after Rev. Prince Hall, founder of Freemasonry among African-Americans. The first Grand Master of African Masonry was Absalom Jones, organizer in 1797 of Philadelphia's first lodge, the African Lodge of Free Masons.""Built here in 1770 - the first meetinghouse of the Church of the Brethren in the nation. Founded in Germany in 1708, the denomination was entirely transplanted to America by 1750 due to religious persecution. Many early Brethren leaders are buried in the cemetery.""In 1938, 3,000 Philadelphia municipal workers launched a strike protesting wage cuts and layoffs, among the first in a major American city. After 8 days, a collective bargaining agreement was reached, leading to the formation of AFSCME District Council 33.""Community efforts in the 1950s and 60s preserved this Gothic and Second Empire style house, one of the earliest recognized for its Victorian period architecture. The surrounding Tulpehocken Station historic district was among the nation’s first railroad suburbs.""The oldest German American organization in the US was founded Dec. 26, 1764, in Philadelphia to provide legal aid, welfare, and language support to German immigrants. Its library, containing one of the nation’s largest German collections, is used by the public and scholars world-wide. The Society moved here in 1888 and continues to preserve German culture and heritage through language instruction, as well as music and educational programs.""The oldest governing body of amateur athletics in America was established in 1858. Rowing club members have participated in competitions at local, national, and international levels. Three-time Olympic gold medalist John B. Kelly Sr. served as commodore, 1935-1940. It hosts some of the largest regattas in the world on the Schuylkill River, one of the nation’s premier courses. Boathouse Row here is an icon of Philadelphia and of rowing.""America’s oldest artists club was founded in 1860 to improve illustration skills. Artists found that social interaction enhanced the creation and appreciation of art. Members included Eakins, Anshutz, Breckenridge, Grafly, Horter, Moran, Pennell, Pitz, Sayen, Wagner, and Wyeth.""When completed in 1908, it was significant for its early use of concrete in bridge construction and as the world’s largest concrete arch bridge. Reformers of the era praised its utility and design. Connecting Germantown and Roxborough, it reduced the travel time between the two neighborhoods from a half-day to minutes, and promoted business and social interaction. This engineering marvel remains a vital transportation artery for Philadelphia.""When completed in 1908, it was significant for its early use of concrete in bridge construction and as the world’s largest concrete arch bridge. Reformers of the era praised its utility and design. Connecting Germantown and Roxborough, it reduced the travel time between the two neighborhoods from a half-day to minutes, and promoted business and social interaction. This engineering marvel remains a vital transportation artery for Philadelphia.""The first European water-powered mill in what is now Pa. was built here c. 1645 by New Sweden governor, Johann Printz. New Sweden Colony was established in 1638 and existed until 1655, when the Dutch, and later, William Penn claimed the territory. Built along the Great Minquas Path, the primitive Norse or Splash grist mill was among the first industrial sites in Pa. Its square anchoring holes remain, visible below the mill dam constructed later.""This prominent, wealthy African American abolitionist couple founded intellectual and benevolent societies for blacks. Dealing in real estate, Joseph provided rentals and loans to both blacks and whites at his barbershop here. Amy was active in the Female Anti-Slavery Soc.""Credited with making the first stars and stripes flag, Ross was a successful upholsterer. She produced flags for the government for over 50 years. As a skilled artisan, Ross represents the many women who supported their families during the Revolution and early Republic.""Milton Snavely Hershey opened his first candy business here on June 1, 1876, at eighteen years of age. The confectionery shop produced and sold candies, nuts, and baked goods. Although initially successful, credit issues led to its closure. Undeterred, Hershey founded the Lancaster Caramel Co. in 1886, which became extremely profitable. Established as a subsidiary of that company, the Hershey Chocolate Co. achieved international success.""In 1855, an enslaved woman and her two sons found freedom, aided by abolitionists William Still, Passmore Williamson, and other Underground Railroad activists. They escaped from their Southern owner while being transported through Philadelphia and settled later in Boston. The incident, which occurred nearby, and Williamson’s subsequent imprisonment and famous trial attracted national attention, further intensifying the North-South conflict.""For years the nation’s leading locomotive manufacturer, it exported products worldwide. Established here by Matthias Baldwin in 1835, it was an early example of integrated industrial organization, employing more than 15,000 workers. Its 39 buildings encompassed 17 acres and transformed the surrounding area from a rural estate to one of the city’s first factory neighborhoods. Relocating to Eddystone in 1928, it ceased production 1956.""Entrepreneur and philanthropist who bequeathed the bulk of his estate to establish Roman Catholic High School for Boys, the first free Catholic high school in the US. Founded here in 1890, the school initiated a diocesan high school system that became a model throughout the nation. Coming from a poor immigrant family, Cahill sought to provide young men from similar backgrounds with the secondary education denied him.""Designed and built in 1784 as a riverside villa by John Penn, Jr., it served as a model for country houses of the Federal period (c. 1775-1830). Administered by the Philadelphia Zoo since 1874, the original Adam Style features, including elegant plaster ceilings, are preserved.""In operation since 1834, Wills was the first US medical facility dedicated to the treatment of eyes and first to train residents in ophthalmology. Committed to patient care, research, and education, Wills is known worldwide for its surgical and medical innovations in eye care.""Nationally prominent Philadelphia architect who designed the US Capitol dome and wings and Girard College. He was consulting architect for Philadelphia’s City Hall. A founder of the American Institute of Architects, he served as its president. Walter lived near here 1837-41.""A pioneer printer in colonial America, Saur produced the nation’s first European language Bible here in 1743. He printed the most widely read German newspaper & used his press to alert the public to German causes. He aided fellow German immigrants with his money and influence.""Aviation pioneer Piasecki developed and flew the 2nd helicopter in the US and the world’s 1st tandem rotor helicopter, initiating the 1st practical use of rotorcraft in the 1940s. His original company, started here, now a division of Boeing, is a world leader in helicopter production. In 1956, he founded Piasecki Aircraft Corp., continuing development of innovative advanced rotorcraft. Awarded the National Medal of Technology in 1986.""On August 3, 1965, Dr. Martin Luther King addressed a crowd of 10,000 at this intersection. His “Freedom Now” tour to Philadelphia, Chicago, Cleveland, and Boston was in gratitude for support given to his Southern Christian Leadership Conference. King brought his message into northern Black neighborhoods, supporting local civil rights efforts and raising funds. His goal was to empower the formation of a coalition to address their common concerns.""Born here, Langstroth revolutionized the beekeeping industry with his 1852 patented moveable frame hive and his manual, The Hive and the Honey-Bee. Both remain in use today. His innovations advanced beekeeping, pollination, and honey production worldwide.""Founded in the 1870s by Chinese immigrants, it is the only “Chinatown” in Pennsylvania. This unique neighborhood includes businesses and residences owned by, and serving, Chinese Americans. Here, Asian cultural traditions are preserved and ethnic identity perpetuated.""Among the oldest of its kind in the nation, the special collections library holds many of the nation’s important founding documents. Founded by prominent citizens in 1824 and located here since 1884, it traces America’s history from the 17th century to the present.""One of colonial America's wealthiest men, Allen supported construction of the state house, now Independence Hall. He helped establish Pennsylvania Hospital and the Academy and College of Philadelphia, which became the University of Pa. He founded the City of Allentown and was Chief Justice of the Pa. Supreme Court. Initially supporting colonial interests, he became a Loyalist until he died here at his estate, Mt. Airy, for which the community is named.""Founded here in 1965, the filmmaking arm of the National Football League helped propel the NFL to popularity in the US. The company's creative innovations won it numerous Emmys, gave fans a new perspective on the game, and revolutionized the presentation of sports on TV.""Opened in 1835, Thomas U. Walter designed it with elements of Egyptian Revival style and following the revolutionary principle of isolated confinement. With later additions, it could house nearly 5000 inmates - African Americans and women in separate wings. H. H. Holmes, considered Americas first serial killer, was executed here. The last hanging in Pa. took place here in 1916, soon replaced by electrocution. Closed in 1963, it was razed in 1968.""Pioneering African American dancer and choreographer. Hall’s innovative infusion of African dance, drumming, and culture into his productions transformed American modern dance. The Ile Ife Black Humanitarian Center, which was here, served as his home and studio.""A prolific landscape artist of over 1000 paintings, Herzog is associated with the 19th century Hudson River School American art movement, which captured unspoiled landscapes across the US. A notable artist in his native Germany, patrons included royalty throughout Europe. Moving to the US in the 1860s, he won many awards, including an 1876 Philadelphia Centennial medal. His home, studio, and birthplace of artist son, Lewis, were here.""This first truly volunteer fire company in the US served as a model for others across the nation. Members, including Ben Franklin, purchased tools stored here in Grindstone Alley, helped provide a fire bell, buckets, and an engine for the city, and developed the idea of fire insurance.""Founded in 1973, the bookstore served as a refuge and cultural center at the onset of the modern lesbian, gay, bisexual, and transgender (LGBT) civil-rights movement. The store provided resources to those working to gain legal rights for LGBT people.""One of gospel music’s first crossover super-stars, she popularized the genre by including secular music elements. A guitar virtuoso and charismatic performer throughout America and Europe, she toured with Count Basie, Cab Calloway, and Benny Goodman. Her home was here.""Held at Logan Square from June 7–28, 1864, this event raised more than one million dollars for the Union cause during the Civil War. Formed to coordinate efforts of women volunteering to support the war effort, the Commission gave relief and comfort to soldiers and their families. In his only official public appearance in Philadelphia, President Abraham Lincoln addressed the crowd on June 16, praising the important work of the organization.""A nationally influential architect, his forceful designs and bold use of industrial materials helped shape American modernism. His works include the Pa. Academy of Fine Arts and U. of Penn Library. Apprentice to Richard Morris Hunt and mentor to Louis Sullivan, Furness was born here.""Built circa 1697 at a Lenape Indian trail crossing, it is the oldest roadway bridge in continuous use in the nation. The tri-arch stone span was an important link on the King's Highway, one of America's oldest roads. It served American and French combined forces on the march to Yorktown, known as the Rochambeau Route, in 1781. The only major modification to the bridge was widening in 1893; the upstream side is essentially unchanged from the original.""An influential revolutionary-era printer, he operated a shop on this block. In 1782, Aitken printed the nation’s first complete English Bible. It received endorsement from Congress, and was the only new Bible available to colonists due to printing restrictions and import embargoes. He also published the Journals of Congress, its official proceedings, and The Pennsylvania Magazine which introduced the writings of Thomas Paine to America.""This famous family lived in the home built here by John B. Kelly. A successful businessman active in city politics, Jack was a 3-time Olympic gold medal winner in the 1920s for rowing. Son John Jr. (""Kell"") won the Diamond Scull at the 1947 British Henley Regatta and a bronze medal at the 1956 Olympics. Both father and son were named to US Rowing and Olympic Halls of Fame. Daughter Grace was an Academy Award-winning actress and Princess of Monaco.""The South Philadelphia Hebrew Association was a dominant professional team from 1918 to 1959, winning 12 league championships. During its heyday in the 1930s, the team was all Jewish. Owner/coach Eddie Gottlieb was a seminal figure in the establishment of the NBA. Instrumental in the growth of pro basketball in its formative years, in later years the team toured with the Harlem Globetrotters. Home games were played here at the former Broadwood Hotel.""Founded nearby in 1812, it is the oldest natural science institution in the Americas. It remains an invaluable resource for the study of life on Earth, with outstanding exhibits and scientific collections. Relocated to Logan Square in 1876, part of Drexel University since 2011.""Founded in 1763, it is one of the nation's earliest Catholic churches and the first Roman Catholic cathedral in Pa. At a time of anti-Catholic sentiment in Colonial America, it symbolized the religious tolerance of Pa. that was later adopted in the US Constitution. The Continental Congress attended services several times as a sign of respect for the Catholic countries of France and Spain, America's allies during the Revolutionary War."It was founded in 1688 by Welsh and English Baptists led by Rev. Elias Keach who sought the religious freedom of William Penn's colony. It was the first permanent Baptist church in Pa. and mother church of Baptist congregations in the mid-Atlantic region. The nearby Pennypack Creek was utilized for baptisms. The cemetery's first recorded burial was in 1692. The existing 1805 church is built on the original 1707 meetinghouse foundation."Here, in 1763, the southernmost point of Philadelphia was determined as the starting point for the survey of one of the most important borders in the nation. Charles Mason and Jeremiah Dixon took scientific measurements of a degree of latitude, elevating professional surveying standards. The survey ended a land dispute begun by William Penn and Lord Baltimore. Western Pa. Indian wars and severe weather delayed completion of the line until 1768.""Centerpiece of Philadelphia's water system, 1815-1909. The neoclassical buildings, designed by Frederick Graff and Frederic Graff, Jr., concealed huge machines that pumped Schuylkill River water to a reservoir above, whence it flowed to the city. Power was originally supplied by Oliver Evans' high-pressure steam engine, the largest of its day. After 1821 the pumps were driven by breast wheels; after 1851, by turbines.""The steps here are the only surviving example of ten passageways along the original Delaware River bank commissioned by William Penn in the early 1700s. Providing public access to the river wharves, the steps promoted transportation, commerce, and westward expansion in Pa.""Philadelphia judge, lawyer, and abolitionist, Lewis played an important role in the drafting and passage of the 1780 “Act for the Gradual Abolition of Slavery.” It was the first abolition legislation in America. Lewis maintained an anti-slavery stance throughout his life as a counselor for the Pa. Abolition Society, defending the rights of slaves freed under this Act. Historic Strawberry Mansion, built in 1789, was Lewis’s summer home.""A founder of the Basketball Association of America in 1946, the forerunner to the NBA, Gottlieb was introduced to basketball as a student here in 1914. “The Mogul” coached the award-winning SPHAS from the 1920s to 1950s and became the first coach of the Philadelphia Warriors, winners of the NBA’s inaugural championship in 1947. Gottlieb served the NBA as schedule maker for 30 years and Chairman of the Rules Committee for 25 years.""A prominent African American Republican who as legislator sponsored a statewide civil rights bill in 1921 that served as a model for future efforts. He was a philanthropist, a founder of Eden Cemetery and Mercy Hospital, and editor of the Odd Fellows’ Journal. Asbury resided here.""America's first Bible society, founded in 1808 by Robt. Ralston, Bishop Wm. White, and Dr. Benj. Rush. In 1812 PBS was first in the US to print Bibles using stereotyped plates which made them affordable and advanced literacy. Bible House has been its center of distribution since 1854."