"Near here stood Tun Tavern, 1693-1781, which is regarded as the traditional birthplace of the United States Marine Corps, authorized by a resolution of the Continental Congress, November 10, 1775. SEMPER FIDELIS""Civil rights leader and activist for women. She was the first African American Secretary of State in the nation. Lived here for 47 years. Spearheaded Commission on the Status of Women and championed the PA Equal Rights Amendment, policies on affirmative action, voter registration by mail and lowering the voting age to 18. Led a successful crusade critical of the music industry and lyrics demeaning to women, African Americans, and children.""BINAC, the world’s first commercial, electronic, stored program, digital computer passed verification tests here, at 3747 Ridge Ave., on April 7, 1949. Customer acceptance of UNIVAC I, the world’s first open market, commercial computer, followed on March 30, 1951. J. Presper Eckert and John W. Mauchly, co-inventors of ENIAC, led the development of both of these pioneering machines, which launched the commercial computer age.""The first racially integrated housing development in Philadelphia, and a model for the nation, was built in 1956 by Morris Milgram, a nationally recognized developer and civil rights proponent. Prominent building and landscape architects, including Robert Bishop, Margaret Duncan, and Louis Kahn, created Modernist houses in the natural setting of Pennypack Park. Original residents include Milgram, Rep. Robert N.C. Nix, & Rev. Leon Sullivan.""Born of White, Black, and Native American descent, he bought his freedom and became a baker of bread for Revolutionary troops. A founder of the Free African Society, he later opened a school for Black children while living here.""One of 22 fire companies established under the Philadelphia Fire Department in 1871. In 1919, it became a segregated African American unit whose members distinguished themselves through professional service. Desegregated in 1952.""Internationally known urban planner, his design concepts shaped Philadelphia's city landscape. As city planning director, 1949 to 1970, his legacy includes Penn Center, Market East, Society Hill, the Far Northeast, Yorktown, and LOVE Park here.""Founded in 1729, PGH was the nation’s longest operating public health care institution. Originally an almshouse, the hospital moved to this location in 1871. PGH implemented innovative medical care and education under Dr. William Osler, and the work of Florence Nightingale protégée Alice Fisher advanced nursing as a profession. Pioneering methods of cancer diagnosis and radiation therapy were applied. The hospital closed in 1977.""The 1873 Masonic Temple, a National Historic Landmark, is home to the Grand Lodge of Pa. Its lodge rooms, featuring varied architectural themes, and its stonework are widely acclaimed. Its prominence in size and location reflects Free-masonry’s importance in American history.""Among America’s most influential rare book dealers, he helped build many of the nation's great libraries. He and his brother Philip established the Rosenbach Museum & Library to share their personal collection with the public. They lived on this block from 1926 to 1952.""A noted Black caterer, Bogle opened a posh eatery at this location in 1813. Recognized for his popular meat pies, he was well known as a master of ceremonies at elaborate weddings, funerals, and banquets for his wealthy clients.""A self-taught Black artist, Bowser, who lived here, began his career as a landscape, sign emblem, and banner painter. He also painted portraits including several of Lincoln and one of abolitionist John Brown.""A record-breaking catcher with Brooklyn Dodgers, 1948-57. He began his professional baseball career while in high school here. In Negro League, 1937-42, '44-45. MVP, National League, 1951, '53, '55. All-Star, '49-'56. Baseball Hall of Fame, 1969.""An early graduate of the Institute for Colored Youth, Catto, who lived here, was an educator, Union army major, and political organizer. In 1871 he was assassinated by rioters while urging Blacks to vote. His death was widely mourned.""Founded, 1695. Erection of present building begun in 1727. Bells were brought from England in 1754. Among the noted persons buried here are James Wilson and Robert Morris, Signers of the Declaration of Independence, and Bishop White.""Opened in 1914, this is the first Black YMCA to have its own building. A social center and meeting place for African-American organizations, it provided recreational and educational opportunities for members of the Black community.""Founded in 1921 by R.R. Wright, Sr., who was born of slave parents, this bank was noted for serving the financial needs of Black customers. It survived the Great Depression and later established offices throughout the city.""During World War II, some 12,000 men who were classified as conscientious objectors to war -- about fifteen percent of them from Pennsylvania -- served in non-military occupations across the United States. Under the leadership of Mennonite, Quaker, and Church of the Brethren agencies, they were engaged in mental health care and medical experiments, in forestry and on dairy farms, and in other important civic projects.""A pioneering African-American jazz musician, composer, saxophonist. Coltrane used African and Indian elements to create a distinctive style which at first shocked audiences but ultimately gained wide acceptance. He lived here, 1952-1958.""At his print shop here, Robert Bell published the first edition of Thomas Paine's revolutionary pamphlet in January 1776. Arguing for a republican form of government under a written constitution, it played a key role in rallying American support for independence."This metallurgist and brass founder opened one of the world's first photographic studios here in the spring of 1840. His collaboration with chemist Paul Beck Goddard in successful experiments to reduce exposure times made it possible to use the camera in portraiture."A celebrated architect and civic planner, Cret lived after 1911 here at 516 Woodland Terrace in this block of Italianate villas built in 1861. His legacy includes the Benjamin Franklin Bridge, Rodin Museum, and (in Washington, DC) the Folger Library.""Famed U.S. Navy officer. Born 1779 in Maryland, he grew up in a house on this site. Celebrated for his role in the Tripolitan War, 1804; capture of H.M.S. Macedonian, 1812; and the subduing of the Barbary powers, 1815. Killed in a duel in 1820. Buried, St. Peter's Church.""Opened in 1895 as the first hospital for Blacks in this city, this facility trained and employed Black medical professionals who were excluded from other hospitals. In 1948, it merged to form Mercy-Douglass Hospital.""African American scholar, educator, and activist. A founder of the NAACP. From 1896-1897, he lived in the College Settlement House at 617 Carver (Rodman) St. while collecting data for his classic study, published in 1899, ""The Philadelphia Negro.""""Erected here by Black bankers, this theater was home to the Lafayette Players, popular vaudeville entertainers. Later bought by white interests and renamed the Lincoln, it hosted major Black performers from the 1920s into the 1940s.""One of the finest realist painters of his time. A master of the art of the human figure. His work included portraits and scenes of sporting and medical events such as The Gross Clinic. A lifelong Philadelphian, he had his home & studios here on Mt. Vernon St.""Original prison built 1822-1836 on a radial plan by John Haviland. Linking solitude with moral and vocational instruction, it exemplified the Pennsylvania System of penology and became a model for over 300 prisons worldwide. Closed 1971.""Rev. Major J. Divine, civil rights leader of the 1930s, established Cooperative Economic Plan, providing life's necessities at nominal prices. Divine Lorraine Hotel here, built 1894 and acquired in 1948, was one of the first integrated hotels of its caliber in the U.S.""The first Black woman elected to a state legislature in the U.S. Fauset, who lived here, won her seat in the Pennsylvania House of Representatives, 1938. She later served as a Civil Defense race relations advisor under Franklin D. Roosevelt.""Born to one of Philadelphia's old families. Literary editor, ""The Crisis,"" 1919-26. A prolific writer of New Negro Renaissance fiction, she produced four full-length novels in addition to her poems and critical essays. She died here in 1961.""Congregation Mikveh Israel's second cemetery, founded 1849. Here are buried Abraham Hart the publisher; Alfred Mordecai, soldier and engineer; Dr. Sabato Morais, rabbi and educator; Judge Mayer Sulzberger; and noted Civil War veterans.""First degree-granting women's medical school in nation, founded 1850. Renamed (1867) Woman's Medical College of Pa. by Ann Preston, Dean. Coeducational, 1969. Became Medical College of Pa., 1970; Allegheny University of the Health Sciences, 1996.""American comedian, raised in Philadelphia, noted for his irreverent wit. Starting out as a vaudeville juggler, he won enduring fame on screen and radio. He was in over 40 motion pictures, 1915-44. As a lad, he worked for a time at Strawbridge's here.""Founded 1809 as one of the first Black Baptist churches in America. Later two members sold themselves into slavery to free a slave to serve as pastor. Erected 1906, this building is located at a later site of the congregation.""Site of the cemetery that served this congregation from 1824 to 1842. Archaeological excavations in the 1980s provided links to ancient African burial customs. The remains were re-interred in Eden Cemetery, Delaware Co., Pa.""Founded 1807 by John Cloucester, a former slave who was instrumental in establishing Presbyterianism among African-Americans. First edifice was dedicated 1811 at 7th & Bainbridge Streets. Church has been at this location since 1957.""Here in 1688, at the home of Tunes Kunders, an eloquent protest was written by a group of German Quakers. Signed by Pastorius and three others, it preceded by 92 years Pennsylvania's passage of the nation's first state abolition law.""Laid out in 1771 by the engineer John Montresor. Heroically held by the Americans under British siege until they were forced out, Nov. 15, 1777. Rebuilt 1798-1800 according to L'Enfant's design and enlarged in the 19th century. A U.S. military post until the 1950s.""A wealthy sailmaker who employed multi-racial craftsmen, Forten was a leader of the African-American community in Philadelphia and a champion of reform causes. The American Antislavery Society was organized in his house here in 1833.""Printer, author, inventor, diplomat, philanthropist, statesman, and scientist. The eighteenth century's most illustrious Pennsylvanian built a house in Franklin Court starting in 1763, and here he lived the last five years of his life.""Here stood Fraunces Tavern, established by Samuel Fraunces after moving from New York where he had operated a famous tavern. He served as George Washington's chief cook, 1790-94, while the President lived in Philadelphia.""Formerly the home of actor Edwin Forrest, later Philadelphia School of Design for Women. Became Heritage House, then in 1968, Freedom Theatre, a community-based Black theater for professional instruction in the theatrical arts."The meetinghouse was built in 1804 on a burial ground granted by William Penn in 1701. It has been continuously used as a place of worship and center for activities of the Religious Society of Friends (Quakers) of the Philadelphia region."The famous American economist was born here, September 2, 1839. His book ""Progress and Poverty"" sold in the millions. Tax socially produced land values, he urged, instead of individually produced labor and capital. He died 1897 in New York.""In 1930s, lawyer Raymond Pace Alexander challenged the school's restriction (mandated by Stephen Girard's 1831 will) to poor white orphans. Attorney Cecil B. Moore later went to the federal courts; by a 1968 ruling the school was opened to all races.""Merchant, financier, philanthropist. Born in France, he came to this city in 1776. Girard gave strong support to both the First and Second Banks of the United States. By his will he established Girard College, which opened in 1848. Gentilhommiere, located here, was his country house after 1797. Girard added the center and western sections of the house and operated a 583-acre farm here.""Established in 1787 under the leadership of Richard Allen and Absolom Jones, this organization fostered identity, leadership, and unity among Blacks and became the forerunner of the first African-American churches in this city.""The Phillies' baseball park from its opening in 1887 until 1938. Rebuilt 1895; hailed as nation's finest stadium. Site of first World Series attended by U.S. President, 1915; Negro League World Series, 1924-26; Babe Ruth's last major league game, 1935. Razed 1950.""The Philadelphia and Reading Railroad’s Terminal Station served passengers from 1893-1984. The train shed, masterpiece of Joseph H. Wilson, is an engineering feat reflecting the era when railroads vied for impressive terminals, both functional and beautiful. The market, located below the shed, descended from colonial-era outdoor markets and began operations in 1892.""Near here, silversmith Philip Syng, Jr. created the inkstand used to sign the Declaration and Constitution at Independence Hall. With Benjamin Franklin, took part in experiments in electricity; founded institutions like the American Philosophical Society.""Built to house wealthy businessmen and their families (1865), and later the headquarters for the Moose Lodge (1912). By the 1960s the Blue Horizon was known as the center of African American community life and as a world renowned boxing venue.""Pioneer baseball professional; a great early 2nd baseman. Played for the Philadelphia Athletics, 1865-75. Phillies' first owner & president, 1883-1902. Published ""Official Base Ball Guide."" His A.J. Reach & Co., maker of sporting goods, was here.""One of largest and most complete Union Army hospitals during the Civil War, from 1862 to 1865. With 4,500 beds in one-story buildings and hundreds of tents, it occupied over 16 acres north of here. Named for Gen. Richard Satterlee, Union Army Medical Purveyor.""Founded 1862 as a patriotic society supporting President Lincoln’s efforts to preserve the Union. Recruited and financed troops during the Civil War. Its membership of prominent citizens later pursued political reform and social, philanthropic, and civic causes.""In 1694, German mystic Johannes Kelpius and his followers established a community near here in response to William Penn’s offer of religious freedom. Members of the “Hermits of the Wissahickon” produced poetry and music, practiced astronomy and botany, and made an early pipe organ, as they awaited the millenium. They welcomed all ethnic groups and Native Americans. The community gradually dissolved after Kelpius died in 1708.""America's earliest surviving photograph was made here about Sept. 25, 1839. Using a cigar box and crude lens, Joseph Saxton of the U.S. Mint created an image of Central High School (now demolished) shortly after Daguerre had announced his process in France.""Supplies for the Lewis & Clark Expedition (1803-1806), bought in Philadelphia by Meriwether Lewis, were stored and shipped to Pittsburgh from here in preparation for the journey’s start. Supplied military goods for Civil War, WWI and WWII. Built 1802-1806. Razed 1963.""Among the foremost architects of the late 20th century. Trained in the Beaux-Arts method at the University of Pennsylvania, Kahn redefined architecture through his extraordinary use of mass, light, and structure. A Penn professor, his office was here.""German-born inventor and showman; exhibited nearby at Maelzel’s Hall, 1826-1831, assisted by Wm. Schlumberger. His Automaton Chess Player (The Turk) was famous for games with Franklin & Napoleon. He patented a metronome; made hearing aids for Beethoven.""Formed nearby in 1827 as the first central labor council in the nation; recognized as the beginning of American labor movement. Represented workers as a class, not by craft. Advocated for ten-hour day; engaged in political activism and workers' education.""Professor, chair of mathematics dept. and vice-provost at University of Pennsylvania, 1799-1814. Tutored Meriwether Lewis in navigation skills to prepare for Lewis and Clark Expedition, 1803-1806. Resided here.""Distinguished Jewish officer and aide-de-camp to Gen. Benedict Arnold during the Revolutionary War. Thought to be complicit in Arnold’s treason, Maj. Franks was later exonerated. A yellow fever victim, he was buried at Christ Church by a Christian neighbor.""African American athlete who dominated black women’s tennis, 1929-1937. She won eight national singles titles from American Tennis Association; starred with Philadelphia Tribunes, women’s basketball team, 1932-1942; played and taught here at YWCA.""America's oldest art museum and school, founded 1805 by Peale, Rush, and other artists. Trained here were Thomas Eakins, Mary Cassatt, Maxfield Parrish, John Marin, Charles Demuth and others. Furness and Hewitt designed the Neo-Gothic building, 1876.""Physician, professor of natural history and botany at the University of Pennsylvania. Author of first American botany textbook. In 1803, he taught natural history to Meriwether Lewis in preparation for Lewis & Clark Expedition, 1803-1806. He lived here."Entrepreneur and philanthropist Drexel created the world's 1st trans-Atlantic banking network from an office located here. It financed many U.S. railroads and businesses of the industrial era. Founder of Drexel University."The first Black graduate of the University of Pennsylvania's School of Architecture, Abele was the chief designer for the nationally known architectural firm of Horace Trumbauer, whose commissions during Abele's career included the Philadelphia Museum of Art and the Free Library of Philadelphia on Logan Square.""Businessman, activist, bibliophile lived here. Director, Philadelphia Building & Loan Assn., pioneering Black firm. Amassed and donated a major collection of rare books, pamphlets on Blacks, antislavery. Founded Afro-American Historical Society.""For 85 years, starting with the Pythians and Excelsiors in 1867, Black ball clubs were a significant part of the Philadelphia scene. The Giants, formed 1902, were soon ""World's Colored Champions."" The Hilldales, Eastern Colored League Champions, 1923-25, won the Colored World Series, 1925. The Philadelphia Stars from 1933-52; they were in the Negro National League, 1933-48, & many of their games took place at this site.""Founded here in 1794 by 15 men and three women from St. George's Church, led by Rev. Harry Hosier. Zoar was active in the Underground Railroad and moved to 12th and Melon Streets in 1883. It is United Methodism's oldest Black congregation.""The author of ""Little Women"" was born here at ""Pine Place,"" Nov. 29, 1832, to educator Bronson Alcott & his wife Abigail. An abolitionist, Civil War nurse, and suffragist, she wrote children's books and gothic thrillers. The Alcotts lived in this county, 1830-34.""The first Black woman to be admitted to the bar in Pennsylvania, she lived here in her later years. Active in the Urban League, she was appointed, 1946, to the President's Committee on Civil Rights.""Here in 1836 a church related company began printing hymnals, religious materials, and works by Black authors of the period. In 1847 The Christian Recorder was published here. Bishop Benjamin Tucker Tanner was editor of the firm until 1884.""This television program had a major impact on the music, dance, and lifestyles of American teenagers. ""Bandstand,"" a local show, began in 1952. Dick Clark became host in 1956, and on August 5, 1957, ""American Bandstand"" debuted on the nationwide ABC network. Until 1964 the show was broadcast from WFIL-TV here. This 1947 building was one of the first designed and constructed. exclusively for television productions.""World-renowned contralto. As a child she sang in this church. Toured Europe & U.S. starting in the 1930s. Her concert at the Lincoln Memorial, 1939, drew 75,000 people. First African-American in Metropolitan Opera, 1955. Delegate to UN, 1958. Died 1993.""Bailey, who lived here as a youth, became one of America's most prominent entertainers. She sang with the big bands during the 1940s and gained her greatest fame in the 1967 Broadway production of ""Hello, Dolly!""""Founded here in 1854 and dedicated to the literary betterment of African Americans, this school was named for a Black astronomer and mathematician who published an almanac and helped survey Washington, D.C.""Three famous actors, Philadelphia-born, were the third generation of this ""Royal Family of the American Stage."" Lionel (1878-1954), Ethel (1879-1959), and John (1882-1942) performed on stage, screen, radio. Their grandparents, the Drews, managed the Arch St. Theatre here."Famed natural scientist. Had the first botanic garden in the U.S. for receiving plants of America and exotics. He was American botanist to king of England and member of several royal societies. House and garden are 1/4 mile east."Educator and diplomat. Bassett was principal, Institute for Colored Youth, 1857-69. He was U.S. minister to Haiti, 1869-77; appointed by President Grant, he was the first African-American to receive a diplomatic post. Here he lived his last years.""The Battle of Germantown occurred at Cliveden, the country home of Pa. Chief Justice Benjamin Chew, on Oct. 4, 1777. A British regiment occupied Cliveden and defended it from full assault by the colonials. Over 70 soldiers died on these grounds. Although it was an American defeat, Washington's bold strategy helped to win French aid for the cause of independence.""Described as the largest U.S. Army hospital of its day; designed by noted architect John McArthur, Jr. Here, wounded Civil War soldiers were cared for, Jan. 1863-May 1865. On 27 acres extending to Stenton Ave., it had some 3,600 beds and treated over 20,000 patients. Razed following the war.""A legendary basketball player, born in Philadelphia. Earned national attention at Overbrook High School and at the University of Kansas. Played professionally for the Harlem Globetrotters, Philadelphia Warriors and 76ers, and Los Angeles Lakers, 1958-73. A dominant center, he set records for both rebounding and scoring; scored 100 points in one game, 1962. Most Valuable Player four times. Member, Basketball Hall of Fame.""Born in 1671, she married William Penn, 1696. They lived at Pennsbury, and in the Slate Roof House here, 1699-1701. During his final illness, 1712-18, and until her death, 1726, she was Pennsylvania's acting proprietor. She was the only woman to control a British proprietary colony for so long.""The financier, statesman, & scholar lived here. President, 1823-1836, Second Bank of the United States, the nation's central bank. He also spurred the rise of Greek Revival architecture and edited the journals of the Lewis & Clark expedition.""Noted physician, lived here. Professor of anatomy at the University of Pennsylvania. President of the American Philosophical Society & Pa. Abolition Society. In 1803, tutored Meriwether Lewis in Medicine & paleontology, in preparation for the expedition west.""On November 11, 1932, Girl Scouts baked & sold cookies for the first time in the windows of the Philadelphia Gas & Electric Co. here. This endeavor soon became a Philadelphia tradition. In 1936 the Girl Scouts of the U.S.A. adopted the annual cookie sale as a national program.""The Philadelphia Saving Fund Society Building is regarded as the first International Style skyscraper built in the U.S. Completed in 1932, it was a radical departure from traditional bank architecture, exploiting the latest technological and structural advances.""Founded 1938 by Marion Turner Stubbs, Lela Jones, and nine other African-American mothers of middle-class families to provide activities for their children despite racial segregation. The local chapter - first in the U.S. - formerly met here.""Built in 1768 for John Johnson. This was home to three generations of a Quaker family who worked to abolish slavery and improve living conditions for freed African Americans. In the 1850s this house was a station on the Underground Railroad. Here and in smaller buildings on the property, men and women escaping slavery found shelter on their way to freedom.""""America's first native-born master of music"" lived here. A prolific African-American composer. Trumpeter of 1st Troop, City Cavalry. Bandmaster, 128th Regiment, Pa. Volunteer Infantry. He was a major force in early American music; traveled widely.""First African American Lutheran pastor in the US. Founder of nation's first African American Lutheran congregation, St. Paul's Evangelical Lutheran Church. It built its brick edifice here in 1834 and worshiped at the site with Jones as its pastor until 1839.""Mary Harris Jones began the March of the Factory Children here, July 1903, to dramatize the need for child labor legislation. Born in Ireland, Jones was an organizer and inspiring presence in the U.S. coal, steel, and textile labor movements.""In 1782 this congregation built Philadelphia's first synagogue at this site. Established about 1740, it had first worshiped in rented quarters here. The congregation built a larger synagogue 1824, and has been elsewhere in the city since 1860.""After serving as a military engineer during the American Revolution, he later led an uprising in his native Poland. Exiled, the General resided in this house from November, 1797, to May, 1798."